{
  "blocked_reason": null,
  "blocking_errors": [],
  "claim": "independent_source_content_fidelity",
  "comparison_version": "independent-html-comparison-v1",
  "coverage": {
    "blocked": 0,
    "completed": 5,
    "failed": 0,
    "passed": 5,
    "required": 5
  },
  "evidence_semantic_identity": {
    "algorithm": "sha256-canonical-json-v1",
    "sha256": "86915841ea662a63d88ded69e385f3f98548ebcc1228b84219fbfe88d5b72c2c"
  },
  "identity": {
    "batch_id": "20260811T171630Z-e80afabe",
    "item_id": "zh-cn/api-management",
    "language": "zh-cn",
    "product_key": "api-management",
    "resource_key": "api-management"
  },
  "mismatches": [],
  "qualification_limitation": null,
  "reconstruction_basis": {
    "basis_id": "v0.5.2-zh-cn-api-management-formal-basis",
    "basis_semantic_identity": {
      "algorithm": "sha256-canonical-json-v1",
      "sha256": "df43667829458078e9fecfa2ad59e601d91b19f0ff82fe4c72a3ad40e15f9537"
    },
    "batch_binding": {
      "batch_id": "20260811T171630Z-e80afabe",
      "batch_manifest": {
        "path": "runs/20260811T171630Z-e80afabe/batch-manifest.json",
        "revision": 1483,
        "sha256": "c7d98dee30f67da391ce4291283d00d710b7162d1b4a0c969b41c126b0048a2f"
      },
      "input_manifest": {
        "path": "runs/20260811T171630Z-e80afabe/input-manifest.json",
        "sha256": "ed0d8968e0b247e4bfcb11fecc88ad5db26f2be7cd3047e8d2018935bc62ca53"
      }
    },
    "comparison_version": "independent-html-comparison-v1",
    "item_identity": {
      "item_id": "zh-cn/api-management",
      "language": "zh-cn",
      "product_key": "api-management",
      "resource_key": "api-management",
      "resource_kind": "current"
    },
    "persisted_payload_identity": {
      "batch_revision": 1483,
      "path": "outputs/zh-cn/pricing/api-management.json",
      "sha256": "0bec4742b1f735d0b267e98c89820d95bf469a3ba6b9715b856d6dd387cecd59"
    },
    "product_definition_identity": {
      "path": "data/configs/products/pricing/api-management.json",
      "sha256": "8210aefca6560368c5571ccd9e2431eb04ac0ce3bd4ad6e47f8518e4f7513676"
    },
    "reconstruction_profile_version": "independent-state-reconstruction-v1",
    "route_map_identity": null,
    "schema_version": "1.0",
    "soft_category_identity": {
      "path": "data/configs/soft-category.json",
      "sha256": "3c930c6e163f27bbbbc4e44c8597feb3d112518ffcc309ee5b7bc007978f02d8"
    },
    "source_identity": {
      "path": "data/current_prod_html/zh-cn/pricing/details/api-management/index.html",
      "sha256": "2ff654ac44611f422bdcc7113fba03b7293a1f4c1f2e51b118db8568e7eb45b4"
    },
    "states": [
      {
        "criteria": [
          {
            "filterKey": "region",
            "matchValues": "east-china2"
          }
        ],
        "locator": {
          "append_selectors": [],
          "container_selector": "div.technical-azure-selector.pricing-detail-tab",
          "content_selectors": [
            "div.tab-content"
          ]
        },
        "removed_table_ids": [
          "API-Management-preview2"
        ],
        "retained_table_ids": [
          "API-Management-preview",
          "API-Management-gateway"
        ],
        "state_id": "c3e7e8a69bf19f9b0d77b3e5fcfdb8dcb1d19414ca7e9df55eb284a16a3325b0"
      },
      {
        "criteria": [
          {
            "filterKey": "region",
            "matchValues": "north-china3"
          }
        ],
        "locator": {
          "append_selectors": [],
          "container_selector": "div.technical-azure-selector.pricing-detail-tab",
          "content_selectors": [
            "div.tab-content"
          ]
        },
        "removed_table_ids": [
          "API-Management-preview2"
        ],
        "retained_table_ids": [
          "API-Management-preview",
          "API-Management-gateway"
        ],
        "state_id": "8e15cb882ef50f91a8d1498533b306d61029e6d713fae0eeb2a1787359bfa7dd"
      },
      {
        "criteria": [
          {
            "filterKey": "region",
            "matchValues": "north-china2"
          }
        ],
        "locator": {
          "append_selectors": [],
          "container_selector": "div.technical-azure-selector.pricing-detail-tab",
          "content_selectors": [
            "div.tab-content"
          ]
        },
        "removed_table_ids": [
          "API-Management-preview2"
        ],
        "retained_table_ids": [
          "API-Management-preview",
          "API-Management-gateway"
        ],
        "state_id": "e377a15171c6eb6f9cff5af0d96c1ddfbbd2d63499fdc94b3a9e69dbedba100a"
      },
      {
        "criteria": [
          {
            "filterKey": "region",
            "matchValues": "east-china"
          }
        ],
        "locator": {
          "append_selectors": [],
          "container_selector": "div.technical-azure-selector.pricing-detail-tab",
          "content_selectors": [
            "div.tab-content"
          ]
        },
        "removed_table_ids": [
          "API-Management-preview",
          "API-Management-gateway"
        ],
        "retained_table_ids": [
          "API-Management-preview2"
        ],
        "state_id": "a60111cd8c5abf40957dd689b9d60ba8a76f8262059b595354f32da191f514d0"
      },
      {
        "criteria": [
          {
            "filterKey": "region",
            "matchValues": "north-china"
          }
        ],
        "locator": {
          "append_selectors": [],
          "container_selector": "div.technical-azure-selector.pricing-detail-tab",
          "content_selectors": [
            "div.tab-content"
          ]
        },
        "removed_table_ids": [
          "API-Management-preview",
          "API-Management-gateway"
        ],
        "retained_table_ids": [
          "API-Management-preview2"
        ],
        "state_id": "f29a755dfdc00825e89fb791672bde6ec5a2a60505496acf95c3d68cef7d274c"
      }
    ],
    "verifier_profile": {
      "id": "v0.5.1-independent-fidelity-minimal",
      "path": "data/configs/independent-fidelity-profiles/v0.5.1-minimal.json",
      "sha256": "7a21615b2a6aea0321b95f666843beee481faa2368b6bffd2c75a02e70a628ba",
      "version": "0.5.1"
    },
    "wire_transform_version": "independent-cms-wire-v1"
  },
  "reconstruction_profile_version": "independent-state-reconstruction-v1",
  "review_projection_artifact_identity": {
    "algorithm": "sha256-projection-artifacts-v1",
    "artifacts": [
      {
        "path": "review.html",
        "sha256": "95eec9665b7e22d3a202ac2ada30cb38a6fabd6fe7ff480b072b75f0d97d9500"
      },
      {
        "path": "fragments/state-001.diff.html",
        "sha256": "5384d3b8205a3b74b20d218b329cdd0ea5200bed3f808d2b14a96514bc124452"
      },
      {
        "path": "fragments/state-002.diff.html",
        "sha256": "5384d3b8205a3b74b20d218b329cdd0ea5200bed3f808d2b14a96514bc124452"
      },
      {
        "path": "fragments/state-003.diff.html",
        "sha256": "5384d3b8205a3b74b20d218b329cdd0ea5200bed3f808d2b14a96514bc124452"
      },
      {
        "path": "fragments/state-004.diff.html",
        "sha256": "5384d3b8205a3b74b20d218b329cdd0ea5200bed3f808d2b14a96514bc124452"
      },
      {
        "path": "fragments/state-005.diff.html",
        "sha256": "5384d3b8205a3b74b20d218b329cdd0ea5200bed3f808d2b14a96514bc124452"
      }
    ],
    "sha256": "192783dfa00a6f32ee6fdf463544bc6bad3cf4c638362f5ab5f9183dede2d3a6"
  },
  "schema_version": "1.0",
  "states": [
    {
      "applied_transform_rule_ids": [],
      "blocking_errors": [],
      "criteria": [
        {
          "filterKey": "region",
          "matchValues": "east-china2"
        }
      ],
      "diff": {
        "path": "fragments/state-001.diff.html"
      },
      "expected": {
        "path": "fragments/state-001.expected.html.txt",
        "sha256": "2092d7f2f7a184fbda197692f9ccc81abccd16f5a7c4f536282b83e53539623f"
      },
      "locator": {
        "append_selectors": [],
        "container_selector": "div.technical-azure-selector.pricing-detail-tab",
        "content_selectors": [
          "div.tab-content"
        ]
      },
      "mismatches": [],
      "payload": {
        "path": "fragments/state-001.payload.html.txt",
        "sha256": "2092d7f2f7a184fbda197692f9ccc81abccd16f5a7c4f536282b83e53539623f"
      },
      "removed_table_ids": [
        "API-Management-preview2"
      ],
      "retained_table_ids": [
        "API-Management-preview",
        "API-Management-gateway"
      ],
      "source": {
        "path": "fragments/state-001.source.html.txt",
        "sha256": "7fbd9f129fe9205d0edf47bddca4f13d930afdcaba5a9fa72517822e12ca3d2e"
      },
      "state_id": "c3e7e8a69bf19f9b0d77b3e5fcfdb8dcb1d19414ca7e9df55eb284a16a3325b0",
      "verdict": "passed"
    },
    {
      "applied_transform_rule_ids": [],
      "blocking_errors": [],
      "criteria": [
        {
          "filterKey": "region",
          "matchValues": "north-china3"
        }
      ],
      "diff": {
        "path": "fragments/state-002.diff.html"
      },
      "expected": {
        "path": "fragments/state-002.expected.html.txt",
        "sha256": "2092d7f2f7a184fbda197692f9ccc81abccd16f5a7c4f536282b83e53539623f"
      },
      "locator": {
        "append_selectors": [],
        "container_selector": "div.technical-azure-selector.pricing-detail-tab",
        "content_selectors": [
          "div.tab-content"
        ]
      },
      "mismatches": [],
      "payload": {
        "path": "fragments/state-002.payload.html.txt",
        "sha256": "2092d7f2f7a184fbda197692f9ccc81abccd16f5a7c4f536282b83e53539623f"
      },
      "removed_table_ids": [
        "API-Management-preview2"
      ],
      "retained_table_ids": [
        "API-Management-preview",
        "API-Management-gateway"
      ],
      "source": {
        "path": "fragments/state-002.source.html.txt",
        "sha256": "7fbd9f129fe9205d0edf47bddca4f13d930afdcaba5a9fa72517822e12ca3d2e"
      },